Column1,v_id,v_title,publishedAt,channelTitle,viewCount,likeCount,dislikeCount,commentCount,category
2644,WD8Jis8txXE,نجم ليفربول قنبلة بن نافلlالنصر يسرق صفقة دودو من الهلالlالعويس يصدم الاهليlالاتحاد يفجر الميركاتو,5/22/2021,رحلة رياضية,29598,1342,47,115,sport
2645,bOHYsdM_b1k,الهلال يخطف سعود عبدالحميدlالنصر يقترب من فيدال برشلونةlشعار الهلال الجديد lالاهلي يطرد 4 نجوم,6/8/2021,رحلة رياضية,27000,1460,53,101,sport
2646,b2Py1hjd3fQ,الهلال يفاجئ سالم بصفقة البرازيلي غويديسlالنصر يفجر الميركاتو بـ 5صفقاتlالهلال يرفض فضيحة راموس,6/19/2021,رحلة رياضية,26633,1420,42,57,sport
2647,Aepofo0B-lQ,الهلال يخطف نجم الشارقةlالنصر يفاوض نجم بايرنlحقيقة تشفير الدوري السعوديlالاتحاد يزلزل الميركاتو,6/27/2021,رحلة رياضية,19130,1218,24,44,sport
2648,I3ucKK5cZ8E,قرار رسمي يحسم صفقة الهلالlشخصية هلالية ترأس النصرlادواردو مع الأهلي ضد الزعيمlمفاجأة وليد الفراج,3/24/2021,رحلة رياضية,21050,1300,32,195,sport
2649,fihCg-CqYnc,الهلال يفعلها ويخطف الوحش هالكlرشيد غزال نصراويlمهاجم عالمي للاتحادlماريغاVSأبو بكرlصفقة الأهلي,6/13/2021,رحلة رياضية,29209,1508,34,65,sport
2650,ROnEW2sDeRQ,الهلال يودع سيبا وفييتو غوميز ويخطف نجم رومانيا وجارديمlالنصر يحسم صفقة رسميةlمحمد نور يصدم الاتحاد,5/31/2021,رحلة رياضية,37618,1618,52,138,sport
2651,F-gMp99cgpM,عملاق العاصمة يخطف نجم الاتحادlسالم يثير الجدلlأول صفقة لآل معمر مع النصرlالصرامي يحرج رئيس الهلال,4/3/2021,رحلة رياضية,20719,1153,26,50,sport
2652,qdZ5WYoxXyA,الهلال يفجرها ويخطف حسان تمبكتيlالنصر يحسم صفقة مفاجئةlالشباب يحسم 3 صفقات رسميةlضربة موجعة للاتحاد,6/1/2021,رحلة رياضية,28137,1352,41,77,sport
2653,SLxAjLbueUo,الهلال يخطف صفقة مزدوجةlالبلوي رئيسا للنصر وسحب مرسول باركlصفقة محلية للشباب ومتريتا يصدم الاهلي,3/23/2021,رحلة رياضية,26804,1370,36,228,sport
2654,0Bu-aV4qsHA,الهلال يحسم الصفقة الثالثةlالنصر يضرب بقوة lالاتحاد يخطف صفقة هجوميةlالأهلي يزلزل الميركاتو,6/18/2021,رحلة رياضية,25067,1332,44,55,sport
2655,nNdRvGX81LA,الهلال يخطف تاناسي والنصر يفجر قنبلة دجانينيlالاتحاد يفاجئ النصرlغوميز يحسمهاlمفاجأة ناصر الشمراني,5/26/2021,رحلة رياضية,44229,1744,61,87,sport
2656,E6Taho2HqrA,مبابي جديد في الهلالlالنصر يفاجئ حمد الله بـ4 صفقاتlجماهير الزعيم تورط ال معمرlصفقة نارية للاتحاد,6/23/2021,رحلة رياضية,24291,1305,53,72,sport
2657,myNXvYyei1w,بن نافل يطرد نجم الهلالlالبلطان يفاجئ آل معمر بصفقة الموسمlآل فتيل يصدم الاهليlباولينيو مطلب اتحادي,6/24/2021,رحلة رياضية,20662,1116,48,81,sport
2658,R66QkcytbLo,الهلال يحسم أضخم صفقة خليجية وعرض أخير لـ تيكسيرا|الجابر يثير الجدل|صفقة رسمية للاهلي|الفرج وبيتروس,2/3/2021,رحلة رياضية,31916,1662,44,155,sport
2659,DW7Yv_IEYvE,الهلال يضرب بـ4 صفقاتlالنصر يخطف ال فتيل والونشlالأهلي يقتحم صفقة الهلالlالاتحاد يحسم صفقة الموسم,6/12/2021,رحلة رياضية,27695,1444,34,86,sport
2660,sYJfXezn07g,النصر يرفض رونالدو ويخطف نجم برشلونةlبلهندة مفاجأة الهلالlبن نافل يفتح النارlباهبري صفقة الاتحاد,6/21/2021,رحلة رياضية,21640,1249,42,167,sport
2661,qGJgCZ-QIC0,الهلال يخطف ال فتيل ومدرب عالمي|استقالات النصر تسقط السويكت|بانيغا يهزم غوميز|جستنيه يهاجم الفراج,3/8/2021,رحلة رياضية,29658,1451,40,159,sport
2662,TAVXO-yWSbs,عاجل الهلال يخطف لاعب رومانيlالنصر يحسم صفقة كويتية مفاجئةlبن مذيكر يفتح النارlرد شقيق العويران,3/30/2021,رحلة رياضية,18051,1161,26,47,sport
2663,mO1ZwUpnbVY,ضربة بن نافل الصيفيةlالشلهوب يفاجئ الهلالlالجماهير تستفز النصرlصفقة عربية للاتحادlرحيل جيوفنيكو,4/15/2021,رحلة رياضية,15616,1036,18,45,sport
2664,FdV3i_rj-00,حرب واتساب بين فهد بن نافل والبلطانlاالهلال يفاوض قاهر برشلونةlالنصر يزلزل الميركاتو بصفقة برازيلية,5/7/2021,رحلة رياضية,21018,1038,27,57,sport
2665,I2RZ9hQcwAM,مارسيلو نجم الريال قنبلة النصرlالهلال يخطف صفقة ثالثة ورحيل جحفليlالأهلي يحسم 3 صفقات نارية,6/25/2021,رحلة رياضية,20837,1216,35,110,sport
2666,VG2i8eFIE7w,النصر يخطف هنريكي والهلال يرد بصفقة أراسكايتاlالعويس نصراويlالأهلي يطرد 5 لاعبينlغوميز يخرج عن صمته,5/23/2021,رحلة رياضية,32111,1475,51,79,sport
2667,Fbt1R6_Iv5Q,النصر يخطف نجم الأهلي الهلال يرد بصفقة الموسمlالاتحاد يقترب من نجم عربيlيحيى الشهري قنبلة الشباب,6/7/2021,رحلة رياضية,31335,1497,34,115,sport
2668,_lhSqSaVj4M,الهلال يتعاقد مع مورايس وصفقة جديدة بعد ماريغاlطرد غوميزlحقيقة رحيل كاريلوlالاتحاد يخطف نجم النصر,5/3/2021,رحلة رياضية,22648,1166,22,41,sport
2669,lPtQIuBBe5g,الهلال يطرد لوشيسكو وسامي الجابر يفتح النار|الفيديو المحذوف يشعل أزمة النصر والشباب|ضربة موجعة للنصر,2/15/2021,رحلة رياضية,26361,1306,34,174,sport
2670,RFncgDB1xhE,أمير سعودي يرد على أزمة الهلال وكورونا|مفاجأة سارة للهلال|الاهلي يخطف صفقة الموسم من النصر,9/21/2020,رحلة رياضية,47336,1536,73,157,sport
2671,j-kdUih8ch8,بن طلال يحذر رئيس الهلال من صفقة تيكسيرا|الهلال يخطف نجم الأهلي|عموري أهلاوي|صدمة للنصر والاتحاد,2/4/2021,رحلة رياضية,28262,1418,39,107,sport
2672,xHI4Yt73clY,دليل جديد يفجر انتقال نجم الأهلي إلى الهلالlتمرد بالنصرlخصم نقاط الاتحادlاحتراف الحمدان واعتراف سالم,3/28/2021,رحلة رياضية,18165,1189,21,136,sport
2673,lR510FKVpSA,الهلال يخطف هدف برشلونةlمفاجأة رؤيةغوميزlرئيس النصر الجديد وطرد السويكتlالسومة يفجر غضب الأهلي,3/22/2021,رحلة رياضية,22454,1358,33,99,sport
2674,xBO28RQQtgU,مكياج ناعم وتحوليه لمكياج جريئ  +  تكبير العيون | ليان ناصر,11/22/2015,ليان ناصر Lyan Nasser,4699621,65364,1967,3265,beauty
2675,b2X9YHFmPco,اسهل طريقه لرسم الحواجب بشكل طبيعي | ليان ناصر,5/15/2018,ليان ناصر Lyan Nasser,3114842,33195,1003,875,beauty
2676,fma1Sc6z1m0,طريقه  ابراز جمال العيون بالمكياج  بشكل جذاب | ليان ناصر,4/25/2017,ليان ناصر Lyan Nasser,837032,34107,360,1156,beauty
2677,DHOHo7amCkc,مكياج سموكي عنابي للعيون الجاحظه | ليان ناصر,8/17/2017,ليان ناصر Lyan Nasser,370081,14069,206,580,beauty
2678,rVdwtxvpVl4,مكياج العيد صباحي + مسائي وكل عام وانتم بخير,6/24/2017,ليان ناصر Lyan Nasser,6270864,164385,3046,4026,beauty
2679,H7Vb991W_vQ,وش البرايمر ؟   انواعه + مميزاته + سلبياته وطريقة استخدامه | ليان ناصر,3/15/2016,ليان ناصر Lyan Nasser,206791,8228,115,262,beauty
2680,cl-7Okgol88,طريقه مكياج تخلي العيون كيوت  | ليان ناصر,10/18/2017,ليان ناصر Lyan Nasser,2987729,94203,1126,2013,beauty
2681,d9PNaGJDWZw,"كيف اعتني ببشرتي ؟ قبل وبعد المكياج ""نوع بشرتي مختلطة""",10/31/2015,ليان ناصر Lyan Nasser,161764,8416,75,372,beauty
2682,7vIZBat1bVk,طرق مهمه بتشقير وصبغ الحواجب مع ابتهاج العيدروس | ليان ناصر,12/30/2018,ليان ناصر Lyan Nasser,3251943,44346,1631,2383,beauty
2683,Iwb4GTk89mE,تتوريال مكياج للبيت ويناسب للبنات الصغار | ليان ناصر,5/16/2019,ليان ناصر Lyan Nasser,3784578,110455,3069,4632,beauty
2684,39PUIPQtMSE,تتوريال طريقه وضح بلاشر بشكل يحلي مره  | ليان ناصر,11/26/2020,ليان ناصر Lyan Nasser,604118,22138,227,801,beauty
2685,O2ED9wh9PEs,اسرع مكياج  للعيد و بأقل الادوات | ليان ناصر,5/22/2020,ليان ناصر Lyan Nasser,523138,20778,359,755,beauty
2686,_Vem4E_1-SU,مكياج كلاسيكي أنيق بالتعاون مع فنتي بيوتي | ليان ناصر,9/26/2020,ليان ناصر Lyan Nasser,1969829,34396,709,1288,beauty
2687,bg2pECBEKWI,مكياج وردي ناعم Soft pink makeup | ليان ناصر,5/6/2020,ليان ناصر Lyan Nasser,4470600,83819,2119,2626,beauty
2688,QajruyxKKto,مكياج ايلاينر ناعم مع روج احمر | ليان ناصر,8/24/2020,ليان ناصر Lyan Nasser,686594,15889,301,1002,beauty
2689,X4oOmldi684,ميكب كلاسيكي بالتعاون مع فنتي بيوتي | ليان ناصر,9/20/2019,ليان ناصر Lyan Nasser,1354744,51145,458,1734,beauty
2690,zci4s9xSQIs,مكياج للمناسبات | ليان ناصر,8/6/2017,ليان ناصر Lyan Nasser,418958,14795,175,507,beauty
2691,Szz29fUIltY,مكياج فرش وقلوسي لصباحيه عروس | ليان ناصر,2/20/2018,ليان ناصر Lyan Nasser,8932195,136960,4313,6686,beauty
2692,TCB12KycZh4,درس مكياج ثقيل للعيون المبطنه + البشره الجافه | ليان ناصر,12/27/2016,ليان ناصر Lyan Nasser,890846,23627,544,758,beauty
2693,E7JvD20PDFo,تتوريال مكياج انيق يبرز الملامح | ليان ناصر,3/8/2021,ليان ناصر Lyan Nasser,143414,7399,62,314,beauty
2694,6v3mvHHmh08,طريقة مكياج للعيون الكبيرة وابرازها بشكل جميل | ليان ناصر,2/6/2018,ليان ناصر Lyan Nasser,734531,20353,418,971,beauty
2695,JYQnE-a58kE,طريقه مكياج كت كريس مع ايلاينر قلتر | ليان ناصر,9/25/2016,ليان ناصر Lyan Nasser,332808,11332,132,409,beauty
2696,0_HsnML1NXA,تتوريال ميكب بمنتجات شي إن SHEGLAM STAY WILD | ليان ناصر,9/3/2020,ليان ناصر Lyan Nasser,560435,21082,455,1430,beauty
2697,gZx4PzHzNJ8,طريقة مكياج للدوام او الجامعة | ليان ناصر,10/2/2020,ليان ناصر Lyan Nasser,419070,17620,275,756,beauty
2698,0h6zflLQCnE,مكياج للمبتدئات | ليان ناصر,2/14/2018,ليان ناصر Lyan Nasser,1324185,28361,784,1520,beauty
2699,kV6-9Vnq2kE,تتوريال مكياج سموكي اسود | ليان ناصر,12/8/2019,ليان ناصر Lyan Nasser,662949,21394,544,1379,beauty
2700,O7IKYeYChLA,مكياج مناسبات للمراهقات | ليان ناصر,11/14/2017,ليان ناصر Lyan Nasser,8396126,183694,6149,11590,beauty
2701,VRTVCR1QEXU,مكياج للعيد صباحي وتحوليه لمكياج مسآئي  | ليان ناصر,7/14/2015,ليان ناصر Lyan Nasser,1305314,23454,588,952,beauty
2702,DfPxZ3lrIK0,مكياج بألوان البنفسج | ليان ناصر,5/29/2019,ليان ناصر Lyan Nasser,188893,8581,115,606,beauty
2703,i1tX-jnZSb4,تصحيح + تنوير البشره السمرا بدون مايقلب رمادي | ليان ناصر,10/24/2019,ليان ناصر Lyan Nasser,1902184,19412,890,1662,beauty
2704,XG5_kDlbNwo,تتوريال مكياج العروس الانيقه | ليان ناصر,4/11/2018,ليان ناصر Lyan Nasser,1325049,43054,481,1727,beauty
2705,1UOhuC4YBl8,مكياج سموكي للعيون الصغيره والجاحظه | ليان ناصر,7/13/2016,ليان ناصر Lyan Nasser,464654,12179,142,522,beauty
2706,54OVrAVQhaE,مكياج للعيد ناعم للعيون المبطنه | ليان ناصر,6/6/2018,ليان ناصر Lyan Nasser,527649,18988,232,1346,beauty
2707,lxmA5N6B6oE,طريقه تحلي العين بالكحل الاسود مع اضافه قليتر | ليان ناصر,6/13/2018,ليان ناصر Lyan Nasser,1548582,22322,602,1201,beauty
2708,2c6Jxs-NEFI,طريقه مكياج للبشره الدهنيه السمراء  | ليان ناصر,9/11/2017,ليان ناصر Lyan Nasser,1506753,38099,1226,2778,beauty
2709,0WJsWvGngSs,مكياج  لوك الدمية | ليان ناصر,2/8/2019,ليان ناصر Lyan Nasser,3653506,84689,2098,6482,beauty
2710,xQIKEqJIJEY,لوك  سموكي ناعم وسهل بدون رموش وعدسات BY LYANMAKEUP,9/13/2015,ليان ناصر Lyan Nasser,666325,20041,270,407,beauty
2711,bySLW-oFi74,ميكب تتوريال مكس وردي واورنج برعاية سماش بوكس | ليان ناصر,6/10/2021,ليان ناصر Lyan Nasser,49153,2953,34,173,beauty
2712,RYjkUOg4WzM,اخفاء عيوب البشره بكونسيلر فقط وبدون فاونديشن | ليان ناصر,3/22/2020,ليان ناصر Lyan Nasser,590555,9005,188,611,beauty
2713,MubR3R4WNvU,مكياج اصفر وعودي مع شوق محمد | ليان ناصر,12/23/2018,ليان ناصر Lyan Nasser,213075,7482,162,778,beauty
2714,gmbifJXflwM,طريقه مكياج مودلز فكتوريا سيكرت Victoria’s Secret Makeup Tutorial | ليان ناصر,9/22/2020,ليان ناصر Lyan Nasser,352067,13685,164,886,beauty
2715,27FHtYGVW_A,مكياج للعيد سوفت سموكي للعيون المبطنة | ليان ناصر,5/11/2021,ليان ناصر Lyan Nasser,50076,2826,40,187,beauty
2716,am34Qyu-kNc,طريقه ايلاينر القطوه وبدون تركيب رموش | ليان ناصر,12/6/2017,ليان ناصر Lyan Nasser,650414,17575,342,1119,beauty
2717,MYuPwJDYiX8,طريقه تركيب الرموش الصحيحه  | ليان ناصر,3/5/2017,ليان ناصر Lyan Nasser,1661112,24694,830,631,beauty
2718,_seb5FxLuYk,تجهيز العروس/ عنايه بشره + مكياج + شعر  | ليان ناصر,5/15/2019,ليان ناصر Lyan Nasser,4788479,78480,2500,4577,beauty
2719,l_h-OJY2Zbw,مكياج موف & اورنج ناعم | ليان ناصر,1/15/2019,ليان ناصر Lyan Nasser,10502103,180594,4523,8345,beauty
2720,FYKIV9OJuUM,مكياج برتقالي و وردي سهل جدا | orange and pink makeup,5/26/2019,Makeup Shahad,1433867,45222,785,1371,beauty
2721,YG3E0_PsAGY,مكياج بني محمر و ذهبي بدون إيلاينر | red brown and golden eyeshadow makeup look without eyeliner,5/24/2019,Makeup Shahad,33292,1591,10,54,beauty
2722,t7h0Fr-YSBc,مكياج وردي باستخدام الروج | pink makeup look using matte lipstick,5/23/2019,Makeup Shahad,100826,3650,52,115,beauty
2723,cvqM4ZDTpiE,(ميك اب كلاسيك ( سحبة العين و الروج العودي classic makeup look with a dark red lipstick,10/15/2018,Makeup Shahad,3002156,57915,3308,,beauty
2724,7JKwpxRehjQ,pink makeup tutorial -  توتريال مكياج وردي للمناسبات,6/12/2018,Makeup Shahad,2086140,50677,1793,1452,beauty
2725,olGSC_hzYsU,مكياج ناعم يسحب العين | simple attractive makeup,6/1/2019,Makeup Shahad,288266,10169,197,413,beauty
2726,yUWanuvgloo,"لوك بني مع ايلاينر مدموج ، باليت واحد و فرشة وحدة | one palate (soft glam )cat eye look",7/31/2018,Makeup Shahad,101272,4966,78,187,beauty
2727,LdsVOXtU22s,15 minutes makeup Glam | درس مكياج ناعم و فخم في ١٥ دقيقة,2/11/2019,Makeup Shahad,59216,2907,48,95,beauty
2728,5_5yGwnDt-s,Purple eyeshadow tutorial 💟مكياج موف و روج لحمي,3/13/2019,Makeup Shahad,16101,678,10,43,beauty
2729,EolmdlZKmEw,توتريال مكياج شمري و سهل ✨shimmery makeup look,11/22/2018,Makeup Shahad,39637,1994,27,131,beauty
2730,k7qI1X3Iios,ميك اب توتريال ناعم و فخم simple glam makeup tutorial,1/8/2018,Makeup Shahad,19088,701,13,53,beauty
2731,H2FhUcOwbaY,مكياج سهل للعيد وكل المناسبات | simple and easy makeup look,5/12/2021,Makeup Shahad,7305,475,19,26,beauty
2732,6ZodqI6ymh0,سموكي بني و ورديات باستخدام الروج | brown and pink smoky using lipstick,3/10/2019,Makeup Shahad,15945,755,24,49,beauty
2733,yJRUSsuIkZo,matte eyes tutorial ميك اب توسيع العين (يناسب معضم اشكال العيون),1/29/2019,Makeup Shahad,28356,1336,46,62,beauty
2734,yKJ6yPNPIWg,سموكي مختلف  ازرق على اخضر bluish green smoky,5/21/2019,Makeup Shahad,11073,573,24,34,beauty
2735,yc4q3xheM-g,2019 makeup look مكياج لجميع المناسبات,1/28/2019,Makeup Shahad,14708,620,10,34,beauty
2736,u9SrRF3fkG8,ميزة خفية بالكامري تغير وضعية البريك الالكتروني من الاوتو للعادي والعكس,11/12/2019,فلوقات السيارات Car VLOGS,77059,1045,84,97,cars
2737,CSSFLM0xZ94,فرة على شانجان ايدو بلس 2022 | تصوير 4K,5/6/2021,فلوقات السيارات Car VLOGS,48267,823,53,66,cars
2738,p0BCQvF5IEs,شانجان ايدو 2022 | داخلية رياضية و طبلون شاشة و 4 كاميرات محيطية,4/19/2021,فلوقات السيارات Car VLOGS,134141,4011,129,203,cars
2739,j5wLoSruZjc,فرة على شانجان CS75 بلس 2022 | تصوير 4K,5/18/2021,فلوقات السيارات Car VLOGS,23850,437,18,26,cars
2740,mwO0kGJoF10,سيارة صينية ملغمة بالكاميرات و الدخول فيها عبر بصمة الوجه | BAIC X7,4/18/2021,فلوقات السيارات Car VLOGS,722159,10358,483,450,cars
2741,Ja1dA69TJ4M,طريقة تشغيل أندرويد اوتو على شاشة السوناتا و سيارات هيونداي بشكل عام,3/26/2019,فلوقات السيارات Car VLOGS,110544,1523,137,98,cars
2742,FCG_zMqpzh4,تعال خذ فرة على الماكسيما في ٣ دقائق فقط | اول مرة اسوق المكسيما بحياتي 🤫,4/30/2021,فلوقات السيارات Car VLOGS,22517,816,63,72,cars
2743,RcvrMbFFbdQ,فتح السيارة و النوافذ عن طريق ساعة اليد نقط عمياء اضاءات ليد كرسي كهربائي ابل كار بلاي اريزو 6 2020,12/13/2019,فلوقات السيارات Car VLOGS,65800,1435,74,149,cars
2744,Q5ATQL9nUfg,تفضل تشتري سيارتك الجديدة من المعارض ام الوكالة ؟ مع ذكر السبب | كيف تسوي الصيانة خارج الوكالة,8/6/2019,فلوقات السيارات Car VLOGS,42239,1406,115,225,cars
2745,OO-cayN0C2E,شانجان CS85 بي ام X6 الصيني  فخامة تفوق التوقعات الصينيين ما يمزحون مواصفات المانية,7/10/2020,فلوقات السيارات Car VLOGS,1086894,12521,646,899,cars
2746,9lKNlMy1wpg,ازيرا ٢٠٢١ وصلت السعودية و تغطية فئة الفل كامل مع الاسعار   فخامة تفوق الخيال | AZERA 2021,6/4/2020,فلوقات السيارات Car VLOGS,1726403,22696,2118,2355,cars
2747,HrL0Dih3bzs,كيا سونيت ما توقعت اني احبها لهالدرجة كيوووووت يا ناس | kia sonet 2021,4/8/2021,فلوقات السيارات Car VLOGS,61373,997,52,35,cars
2748,8JX5Db4S0hU,حل مشكلة إختفاء الساعة من شاشة السوناتا و الجينيسس,8/21/2019,فلوقات السيارات Car VLOGS,7866,228,10,39,cars
2749,r42z1amJ4m8,زوتي T700L  | جاكوار الصيني فخامة و مواصفات تفوق التوقعات الصينيين ما يمزحون,12/22/2020,فلوقات السيارات Car VLOGS,887911,7986,626,299,cars
2750,qUWpLtniYSE,نيسان ماكسيما بعد ممشى ٣٠ الف  كم,5/4/2021,فلوقات السيارات Car VLOGS,45157,1425,53,91,cars
2751,vhZitF-vUjI,شيري تيجو ٧ برو ٢٠٢١ الفئة الفخمة من شركة شيري الصينية,6/15/2021,فلوقات السيارات Car VLOGS,16985,464,19,25,cars
2752,44xBDWsNfvo,اول سيارة صينية بفتحة سقف بانوراما بفئتها | تجربة تفصيلية شانجان ايدو بلس 2022,5/8/2021,فلوقات السيارات Car VLOGS,108063,2384,125,175,cars
2753,b-4HHOiarYk,كيا K5 موديل 2021 الجديدة كليا | ضروري تشوف المقطع قبل ماتشتري,6/5/2020,فلوقات السيارات Car VLOGS,1520578,19518,1207,1373,cars
2754,_r0ZBNs4qCY,تعال خذ فرة على بنتلي فلاينج سبير محرك V8 في ٣ دقايق فقط | لاول مرة على مستوى الشرق الاوسط,4/29/2021,فلوقات السيارات Car VLOGS,12506,369,15,19,cars
2755,aCWqZh1qRBQ,النترا ٢٠٢١ وصلت السعودية بمواصفات خرافية,10/25/2020,فلوقات السيارات Car VLOGS,388034,5498,355,291,cars
2756,nbC23cLvLO0,فرة مع اقوى سوناتا ان لاين 2021 بمحرك الجينيسس صدمتني بقوتها,5/25/2021,فلوقات السيارات Car VLOGS,8455,352,17,27,cars
2757,SlxoarXqLdU,اول وانيت من هيونداي  سنتاكروز مواصفات عجيبة وغريبة,4/18/2021,فلوقات السيارات Car VLOGS,1210514,27094,1048,339,cars
2758,Bvtw4p5TZtA,تغطية حصرية لسيارة ام جي ٦ موديل ٢٠٢١ | تصوير @China Auto Show,8/18/2020,فلوقات السيارات Car VLOGS,180291,1999,139,188,cars
2759,zufgbG0kIZg,تجربة جيب كيا سورينتو على الفصلة تتوقعون على كم يفصل.,1/15/2020,فلوقات السيارات Car VLOGS,176624,3275,158,157,cars
2760,VMcM2jzPA34,هل تعلم أن السعودية تصنع شاحنات مرسيدس منذ عام 1977,5/9/2019,فلوقات السيارات Car VLOGS,41628,835,89,217,cars
2761,qnsbTBD9ND8,اصغر واجمل جيب صيني | ام جي زد اس توربو  MG ZS T 2021,10/18/2020,فلوقات السيارات Car VLOGS,205319,2442,125,128,cars
2762,QGHqT-ENAls,هيونداي اكسنت 2021 بشبك مذهب,12/8/2020,فلوقات السيارات Car VLOGS,54079,1067,56,67,cars
2763,pOy6eJ4YGT0,توسان ٢٠٢٢ وصلت السعودية حبيتها من اول نظرة 😍 |  انتم ايش رايكم,4/5/2021,فلوقات السيارات Car VLOGS,386523,4620,380,283,cars
2764,WAllAFN9eao,شيري اريزو 6 2020 | قيمتها 58675 ريال ايش رايكم فيها ؟,9/20/2019,فلوقات السيارات Car VLOGS,206504,2807,218,440,cars
2765,AcU_cDboyro,اقوى سوناتا وصلت السعودية بقوة ٢٩٠ حصان وعزم ٤٢١ نيوتن  ايش رأيكم فيها وكالة الناغي جدة,3/17/2021,فلوقات السيارات Car VLOGS,115629,2431,159,396,cars
2766,4uD761FOK7Y,شانجان CS85 بي ام X6 الصيني  فخامة تفوق التوقعات الصينيين ما يمزحون مواصفات المانية,5/19/2020,فلوقات السيارات Car VLOGS,382534,4777,384,629,cars
2767,8v-oKBGEYeg,ام جي اتش اس ٢٠٢٠ نص فل واهم الفروقات | MG HS 2020,10/16/2019,فلوقات السيارات Car VLOGS,20676,191,23,22,cars
2768,OsitANRV-e4,ميزة خطيرة ب هيونداي سنتافي 2021 تنبهك من كاميرات ساهر | اذكى سيارة من  هيونداي توصل السعودية,2/19/2021,فلوقات السيارات Car VLOGS,291565,3385,189,122,cars
2769,UT7IUg5cYJg,جي كلاس الصيني وصل السعودية |BAIC BJ80 بقيمة ربع مليون,4/11/2021,فلوقات السيارات Car VLOGS,909464,12706,1304,979,cars
2770,i-zlFapai8k,جوهرة هيونداي ازيرا ٢٠٢١ فل كامل اتحداك اذا ما وقعت في غرامها | فخامة تفوق الخيال | AZERA 2021,6/26/2020,فلوقات السيارات Car VLOGS,5011718,59642,4070,3849,cars
2771,KVFZKXn7SNk,اصغر و ارخص سيارة من شانجان | شانجان السفن ٢٠٢٠ | صرفية جبارة تحطم كل المنافسين الصينيين,8/22/2020,فلوقات السيارات Car VLOGS,40906,728,64,142,cars
2772,LVptnLCFEr8,كيا كي ٥ نص فل موديل ٢٠٢١ | كيا K5 مويل ٢٠٢١ من معرض كيا الجبر,6/2/2020,فلوقات السيارات Car VLOGS,51016,741,58,98,cars
2773,PXuRCUoYbIw,كامري اللومير اعلى واغلى وافخم فئة  ايش رايكم | شرح الفروقات بين الفئات | الجز١,11/11/2019,فلوقات السيارات Car VLOGS,57096,1284,86,193,cars
