Column1,v_id,v_title,publishedAt,channelTitle,viewCount,likeCount,dislikeCount,commentCount,category
0,OQfwIaKnvLQ,نحن والإباحية.. مع سعود الحسّاني,10/15/2020,بودكاست مربَّع,61349,2110,50,377,talkshow
1,pmCOAue-zsE,"كيف تعمل العملات الرقمية وماهو ""بلوك تشين"" و""بيتكوين"" بالضبط؟؟ مع محمود يار",9/24/2020,بودكاست مربَّع,14382,394,17,26,talkshow
2,koz3GG3atWg,بودكاست مربع | سوق الأسهم 101.. مع صلاح خاشقجي,7/30/2020,بودكاست مربَّع,215575,4342,182,327,talkshow
3,MMDF1AGW3vg,الجزء الثاني: النسوية دين بلا إله.. مع عدنان معتوق,11/13/2020,بودكاست مربَّع,75220,2656,96,604,talkshow
4,FEwIjsZLWmQ,#بودكاست_مربع | تجربة في التأليف.. وقصة التسع كتب في تسع سنين. مع عبدالله العجيري,10/23/2019,بودكاست مربَّع,154311,4425,101,493,talkshow
5,1PYktRKE4UY,الخلاف مع الوالدين.. كيف نفهمه ونعيش معه؟ مع د.هبة حريري,10/22/2020,بودكاست مربَّع,24480,918,24,63,talkshow
6,_mgpsq4rdCY,#بودكاست_مربع | ما الذي يحدث في جلسة علاج نفسي؟ وكيف يفكر الأخصائي؟.. مع د. أروى عرب,11/14/2019,بودكاست مربَّع,24585,817,25,105,talkshow
7,3wZDPSB9Tus,"بودكاست مربع | كيف نشأت العلوم الشرعية؟ وكيف تؤثر ""أصول الفقه"" في حياتنا اليومية؟ مع عبيد الظاهري",9/27/2019,بودكاست مربَّع,56794,2135,35,239,talkshow
8,KgvcSHbREdE,بودكاست مربع | النسوية دينٌ بلا إله.. مع عدنان معتوق,11/6/2020,بودكاست مربَّع,165574,5400,322,1046,talkshow
9,svc_VanszDQ,بودكاست مربع | أن تغير مسار حياتك كليا.. بعد ٧ سنوات طب. مع أبيّ البشير,10/4/2019,بودكاست مربَّع,18687,556,15,43,talkshow
10,NwIZCnnv9KU,يسكن المدينة وفي قلبه قرية.. مع علي شنيمر,4/28/2021,بودكاست مربَّع,4618,168,3,11,talkshow
11,icsvV-CK-as,#بودكاست_مربع: رحلة حول المملكة.. رحلة حول الذات.. رحلة في حياة الناس.. مع محمد المطيري,8/1/2019,بودكاست مربَّع,43820,1123,45,164,talkshow
12,3Yw4ucGbsIY,بودكاست مربع | المسير خارج جنة عدن.. مع محمد بنونة,8/6/2020,بودكاست مربَّع,231493,3845,312,463,talkshow
13,q-_xDLOMABM,أربعون رجلًا ماتوا من أجل قهوة! مع ماجد الأهدل,4/9/2021,بودكاست مربَّع,21657,776,32,111,talkshow
14,U7iNu8OjnhQ,رسالته في الحياة تضييع وقت الناس! مع فادي يحيى,9/30/2020,بودكاست مربَّع,10154,325,8,35,talkshow
15,e6W_8bKtwJE,وهم العبقرية وكذبة الشغف.. مع عبدالرحمن سفر,9/17/2020,بودكاست مربَّع,28101,751,48,80,talkshow
16,2Df2TRYy8pc,بودكاست مربع | المطاوعة الكول.. و١٠ سنوات لشهادة بكالوريس.. مع راكان عسيري,10/17/2019,بودكاست مربَّع,63553,1359,124,340,talkshow
17,bvEheY59GrI,لن تصبح ستيف جوبز!! مع فواز سعد,4/14/2021,بودكاست مربَّع,14307,370,18,39,talkshow
18,y3h3yviO8Wg,بودكاست مربع | كورونا! نخاف ولا ما نخاف؟ مع د. نزار باهبري,3/16/2020,بودكاست مربَّع,28847,575,31,45,talkshow
19,8bAL8hcippw,التاريخ الاجتماعي لمؤرخ اجتماعي.. مع منصور العساف,8/20/2020,بودكاست مربَّع,9009,218,8,25,talkshow
20,2sjEOMa2Ay8,حتى لاتكون مسخًا.. مع عبدالله عادل,11/19/2020,بودكاست مربَّع,28946,930,64,180,talkshow
21,nBOX86dLtIw,لتجعلها السنة الأخيرة وانت دبٌّ.. مع جمانة جلال,12/30/2020,بودكاست مربَّع,16222,508,24,98,talkshow
22,4AKYj1eB3wE,بودكاست مربع | من طفولة في بيت نصيف.. إلى حياة بلا أعداء. مع العم عبدالعزيز نصيف,10/31/2019,بودكاست مربَّع,6066,157,5,41,talkshow
23,sYEcIQFdnGo,"مع سيف القرعاوي - 1:3:19, 1.39 PM",1/5/2019,بودكاست مربَّع,3214,61,3,16,talkshow
24,U2pewLTw_08,السفر إلى المكسيكيين.. لا المكسيك.. مع سيف القرعاوي,8/26/2020,بودكاست مربَّع,22753,481,39,81,talkshow
25,PsXQ115U_q0,أن تجد معنى لحياتك.. مع محمد عبداللطيف,12/16/2020,بودكاست مربَّع,17070,477,43,90,talkshow
26,sfzS7HbgFyI,"نقاش مع ماجد الأهدل حول اختيار اسم البودكاست، عن الهويات والتسمية واللغة..١: #بودكاست مربع",11/5/2018,بودكاست مربَّع,2781,108,2,13,talkshow
27,D63-w2CWUUs,بودكاست مربع | كيف تتأثر حياتك ومشاعرك وقراراتك بالحداثة السائلة؟ مع الغازي محمد,4/10/2020,بودكاست مربَّع,5581,251,4,19,talkshow
28,3Q4BA1mRc4E,رحلة بين جيلين.. مع هتون قاضي,4/21/2021,بودكاست مربَّع,8633,292,23,39,talkshow
29,18DNlUW8vyw,١٤- الإعلان عبر المشاهير بدأ منذ بداية البشرية وسيستمر ليوم القيامة! مع أنس عبده,3/28/2019,بودكاست مربَّع,659,26,0,4,talkshow
30,9TbPmPNwWqw,درهم تعزيز صحة خيرٌ من قنطار أمراض! مع د.صالح الأنصاري,10/7/2020,بودكاست مربَّع,7908,260,9,32,talkshow
31,qbqjdmzlRaQ,٢٤: من عمق قصة حياة سلمان ابن البلد.. كيف يعيش بين هويتين؟,6/13/2019,بودكاست مربَّع,17641,330,21,42,talkshow
32,A1cUwA79kT8,بودكاست مربع | ليش الشركات الكبيرة تسوّق مع انها ما تحتاج تسويق؟ مع د. ثامر باعظيم,3/25/2020,بودكاست مربَّع,3208,102,6,10,talkshow
33,DnhBVgZyS6U,بودكاست مربع |  الحوسة الفكرية لشاب عادي.. مع محمود زيني,9/19/2019,بودكاست مربَّع,7812,240,16,60,talkshow
34,QPXGRFHFPvk,قصة متحف الشريف.. مع علي الشريف,5/6/2021,بودكاست مربَّع,2731,94,3,18,talkshow
35,bac2U8MY-iE,بودكاست مربع | التفكير كمبرمج أدخله عالم الضيافة.. مع علي العامر,7/8/2020,بودكاست مربَّع,3015,112,5,13,talkshow
36,j5VEYV7Qipg,"""في روايتي الأخيرة، لما قسيت على البطل.. بكيت"" عن الرواية والأدب، مع الروائي طاهر الزهراني",12/6/2018,بودكاست مربَّع,890,30,0,2,talkshow
37,#NAME?,"١١- حديث عن “الفلوس” مع مليونير بالعشرينات من العمر، يدير في شركاته أكثر من مليار ريال",3/7/2019,بودكاست مربَّع,12429,309,37,33,talkshow
38,PvAr5B5pBiI,بودكاست مربع |  داخل عالم التطوع مع مؤسس فريق رواء.. مؤيد قشقري,11/7/2019,بودكاست مربَّع,2743,105,2,21,talkshow
39,sZ2JnFrxwgM,هل الشغف يأكِّل عيش؟ مع علي البحراني,8/15/2019,بودكاست مربَّع,7726,253,10,23,talkshow
40,cx9L52rhG-0,"""كنت الغواص السعودي المؤهل الوحيد في السبعينات"" كيف عاش أبو ابراهيم حياته مع الغوص،دراسة وشغفا وعملا",12/20/2018,بودكاست مربَّع,424,14,0,3,talkshow
41,exffgP24StY,بودكاست مربع | جلسة علاجية على الهواء! مع سندس ملائكة,8/13/2020,بودكاست مربَّع,15505,428,44,86,talkshow
42,JuAvjPh8fYk,٢٥: حياة طبيعية مع اكتئاب مزمن.. وفاء خالد,6/19/2019,بودكاست مربَّع,7409,146,8,23,talkshow
43,Go0FCN9a4-A,١٢- كيف تعلم معاذ الجهني بنفسه ليصنع من شغف البرمجة فرصا عظيمة له ولغيره,3/14/2019,بودكاست مربَّع,2639,83,4,6,talkshow
44,kNshvgZpkC8,"شبكات التواصل الاجتماعي، كذبة كبيرة؟ مع عبدالله العلاوي",10/28/2020,بودكاست مربَّع,15770,435,26,34,talkshow
45,RTKVcJ47qPs,بودكاست مربع | بعد أن تصبح مشلولًا في حادث مميت.. كيف تعيش؟.. مع عبدالعزيز القحطاني,4/2/2020,بودكاست مربَّع,2536,104,1,11,talkshow
46,C5UeZA57m4M,لازلنا نهتدي بالنجوم! كل يوم!.. مع ملهم هندي,9/2/2020,بودكاست مربَّع,4736,167,10,24,talkshow
47,nW6_68miMxQ,سيرة فنان لن تنساه مكة.. مع ضياء عزيز ضياء,12/2/2020,بودكاست مربَّع,4477,154,9,23,talkshow
48,0N6nSc3nHDA,١٣- أبوجاسم يجيب على السؤال الخطير: هل الدين علم؟ ويتهم نظرية التطور بأنها علم زائف!,3/21/2019,بودكاست مربَّع,6916,251,14,58,talkshow
49,txjqw39fELs,مشهور الدبيان: أنا لا أخجل من الماضي في القيمرز وسوالف بزنس جاء نتيجة توجهي وتفرغي للتجارة,8/15/2020,معالي المواطن,144748,5855,146,457,talkshow
50,XrWL3hDtAjQ,حسام باعظيم أخصائي التخاطب: التأتأة قد تنتهي بشكل مفاجئ.. وهذا علاجها,10/29/2019,معالي المواطن,139580,3241,87,867,talkshow
51,9k6xm_Q3o30,العجوني: اشتريت ببغاء عشان يقلد أصوات لكن..!!,9/12/2020,معالي المواطن,237643,2466,119,86,talkshow
52,b0qxEdS_wLk,كيف بدأ وليد العواجي فن الخدع البصرية؟,2/5/2021,معالي المواطن,35372,257,12,24,talkshow
53,GFRgg6-4_Jg,الكابتن الغامدي: بكيت بسبب عدم قبولي في كلية الملك فيصل الجوية ولكن..,8/29/2020,معالي المواطن,17892,261,5,43,talkshow
54,JcDW4uWLoc8,"خدعة  ""ربيع الربيعان"" الجديدة تُذهل العلياني",2/5/2021,معالي المواطن,48952,330,20,34,talkshow
55,qZ-d5yclKII,قصة سعودي زرع الحيرة بين الأجهزة الأمنية الأمريكية,4/18/2018,معالي المواطن,11937,167,5,24,talkshow
56,VFokraFGVYE,متى أعرف أني مكتئب؟,10/15/2019,معالي المواطن,13947,240,10,49,talkshow
57,xHIJuo2338E,"الطفل ""وليد العواجي"" يُبهر علي العلياني",2/5/2021,معالي المواطن,73382,506,36,128,talkshow
58,awytQX-vb7o,"سالم العتيبي حارس أمن: أنا خريج محاسبة مالية، وأستلم راتب قرابة 4 آلاف ريال.",10/16/2018,معالي المواطن,30300,324,18,105,talkshow
59,kEoXGbL5S-s,"أغنية ""زين سويت"" الفنان نايف البدر",4/2/2021,معالي المواطن,31177,402,9,48,talkshow
60,3lFUVStqRI8,"لماذا كان يرفض ""ربيع الربيعان"" التصوير في بداية مشواره ومتى كان ظهوره؟",2/5/2021,معالي المواطن,52678,333,19,42,talkshow
61,dNte8MIrt_o,ماذا قال طلال مداح لنايف البدر عندما غنى أغنية وترحل,4/2/2021,معالي المواطن,22530,182,10,20,talkshow
62,lhyn01xo-JA,شخصية التمساح.. هل ستعود مع إبراهيم الخيرالله؟,10/23/2020,معالي المواطن,42024,785,56,82,talkshow
63,d76GfprRPNk,ناظم ظفر يقلد 8 معلقين مباريات كرة قدم بشكل متتالي وبلا توقف  هل تعرفت عليهم؟,9/12/2020,معالي المواطن,146981,1626,96,167,talkshow
64,E86FtgMxcm0,كيف قرأ  فنان الخدع البصرية صالح العبيدي أفكار علي العلياني؟,2/5/2021,معالي المواطن,47315,341,31,49,talkshow
65,3YXADAOhXSc,محمد القحطاني بطل العالم للخطابة عام 2015 يتحدث عن معاناته مع التأتأة وتغلبه عليها,10/29/2019,معالي المواطن,18046,432,12,25,talkshow
66,W-FzOp5OXnM,هل ينقل مريض الإيدز العدوى عن طريق الممارسة الجنسية؟,3/11/2018,معالي المواطن,121457,790,75,234,talkshow
67,UwbbK1T3LzI,ربيع الربيعان: أنا من يضع قوانين اللعبة ولايستطيع أحد كشفي حتى لو علمته الطريقة,2/9/2021,معالي المواطن,81679,939,40,125,talkshow
68,pccRiaBiWWc,أغنية وطني الحبيب للفنان الراحل طلال مداح يبدع قاري في عزفها,2/7/2019,معالي المواطن,530382,6990,313,726,talkshow
69,JCGhxNa1L8A,ما هو علاج الإيدز؟,12/11/2019,معالي المواطن,27499,223,16,132,talkshow
70,FudVkyAwQAk,الموسيقار ناصر الصالح يغني أحدث أعماله حصريا لصيف معالي الواطن,7/11/2020,معالي المواطن,22213,230,12,29,talkshow
71,yMbXfjiR1Qg,تقرير مؤثر عن حياة الفنان الراحل أبوبكر سالم #معالي_المواطن,12/12/2017,معالي المواطن,246078,1931,117,308,talkshow
72,AEE2femyB7Y,نايف البدر: غنيت مع محمد عبده وكانت فرصة ذهبية والشيخ خالد بن محفوظ له بصمة لا تنسى في حياتي,4/2/2021,معالي المواطن,11229,70,2,8,talkshow
73,TZn8B6J1ryQ,الفنان نايف البدر يروي قصة بدايته ويكشف عن أسم الرجل الذي اكتشفه,4/2/2021,معالي المواطن,15656,103,7,22,talkshow
74,X60ekOCzHTk,بدر بن هزاع : ما أنصح أي شخص يجرب أكل الزجاج,2/5/2021,معالي المواطن,29318,335,26,29,talkshow
75,AfQ9ztFiE_Q,هل الإصابة بمرض الروماتيزم مرتبطة بالعمر؟  وهل يوجد علاج نهائي لهذا المرض؟,2/27/2019,معالي المواطن,16125,194,8,66,talkshow
76,x0fgALfXz2s,محمد مسجل بالهوية الوطنية كأنثى.. يروي معاناته لـ #معالي_المواطن,10/30/2019,معالي المواطن,129168,1427,158,577,talkshow
77,YzXEVWUfOr0,ماذا يعني التصنيف الصحي؟خريج بكالوريس التغذية ابراهيم الجابر يفصل في ذلك,10/15/2018,معالي المواطن,5013,57,1,12,talkshow
78,ZY5xK6WK6u8,الفنان فايز المالكي يروي قصته مع البهاق لمعالي المواطن ويقدم نصائح للتعايش معه.,1/27/2019,معالي المواطن,13685,122,3,18,talkshow
79,A4jH8O3tnPU,علي العلياني متردد يسأل شاكر الشريف,10/23/2020,معالي المواطن,60196,771,59,42,talkshow
80,awhbt85fR2w,آراء مختلفة حول الفرقة الكورية BTS وموسيقاها,10/16/2019,معالي المواطن,118849,6564,501,1858,talkshow
81,nSPjngh9r7k,في ضيافة #معالي_المواطن .. الطفلة ليان فياض ودميتها التي تساعدها في السكري,11/13/2019,معالي المواطن,17039,220,10,17,talkshow
82,pKVP6l3VmDU,قصة الطائرة المطعم كاملة,2/25/2019,معالي المواطن,25188,175,10,41,talkshow
83,nRvYQX5PptI,الكابتن الغامدي: دخلت مجال الطيران بسبب أجرة سيارة التاكسي!!,8/29/2020,معالي المواطن,15650,208,12,10,talkshow
84,bYSdEmZ27FE,بدايات فيصل السيف وذكريات تقديم البرامج التلفزيونية.. تتذكرونه؟,6/27/2020,معالي المواطن,13872,233,16,25,talkshow
85,LZ5Q2Hg9ynE,صالح العبيدي يروي تفاصيل بدايته في مجال الخدع البصرية؟,2/5/2021,معالي المواطن,14086,126,5,6,talkshow
86,sVoDNjTIT-0,"متضرر على بند الأجور يروي لـ""معالي المواطن"" معاناتهم",2/12/2018,معالي المواطن,13970,209,6,58,talkshow
87,fAcIxNpi0p4,طريق الموت في الليث.. تقرير خالد الفرحان,10/9/2018,معالي المواطن,17596,281,13,87,talkshow
88,AtVYIX9skuc,الشاعر علي بن حمري يستقبل مكالمة والدته المفاجئة أثناء تصوير حلقة,1/15/2019,معالي المواطن,303441,2110,142,222,talkshow
89,ZhxIXi6IOs8,قطة.. غيّرت حياة عبدالرحيم بوعريش,1/29/2021,معالي المواطن,11254,406,14,11,talkshow
90,-3fjVaZYfuQ,شاعر فرسان القصيد فواز العازمي يشرح كيف بدأ فن المحاورة,4/3/2019,معالي المواطن,7728,112,4,22,talkshow
91,_9rjM6XJf5I,عادة التصفيق وتأثير الهبوط على نفسية الراكب.. وش أثرها على كابتن الطائرة؟,8/29/2020,معالي المواطن,7688,67,2,1,talkshow
92,VHScQkHMmxM,ملائمة خريجي معاهد الثانوية الصناعية لسوق العمل,11/7/2018,معالي المواطن,13524,236,10,76,talkshow
93,3so8pRKsa4U,د. عبدالله الحقيل: يمكن زواج المصاب بالإيدز من شخص غير مصاب,12/11/2019,معالي المواطن,14115,118,6,97,talkshow
94,rHvd_P_coUs,"أغنية ""إنسان عادي"" الفنان نايف البدر",4/2/2021,معالي المواطن,17881,198,7,26,talkshow
95,RkQzKoAVOOM,"سر محبة  ""الأحواز""  للسعودية",9/23/2018,معالي المواطن,26954,805,52,505,talkshow
96,LtXAJ8zQK2I,معاناة سكان ضاحية الملك فهد بالدمام من نقص الخدمات,3/6/2018,معالي المواطن,9860,113,3,21,talkshow
97,oaDiiZsgg9E,المدارس الليلية وشاكر الشريف.. وش القصة؟,10/23/2020,معالي المواطن,17341,198,12,14,talkshow
98,NB7WAcmGkPw,#وجبات_15_ثانية | البرياني | 15smeals | Biryani#,4/4/2017,15 ثانية,829662,14244,436,425,food&cooking
99,8CBcoAfHxFw,#وجبات_15_ثانية | تكا مسالا 15s | Tikka Masala#,10/10/2016,15 ثانية,1003746,16801,536,325,food&cooking
100,P4QSXEpZKqM,#وجبات_15_ثانية | سندوتشات الكودو 15smeals | Kudu Sandwiches#,12/10/2017,15 ثانية,597317,11260,294,328,food&cooking
101,Udq8V90Ol6I,#وجبات_15_ثانية | كيكة التمر بالحليب المكرمل,1/12/2017,15 ثانية,322462,6416,170,241,food&cooking
102,C8z3AyR5wDA,#وجبات_15_ثانية | فتة الباذنجان 15smeals | Aubergin Fatah#,3/1/2018,15 ثانية,756826,13418,364,270,food&cooking
103,n0-vpjqv4DA,#وجبات_15_ثانية | مشخول السمك 15smeals | (Mashkhool (fish with rice#,11/10/2016,15 ثانية,154535,4302,85,132,food&cooking
104,ZsSoVLM9wS0,#وجبات_15_ثانية | بتر تشكن 15smeals | Butter chicken#,3/13/2017,15 ثانية,516396,8857,273,288,food&cooking
105,E9ymrrTyh_A,#وجبات_15_ثانية |  المصقعة السريعة 15s | Moussaka #,7/11/2016,15 ثانية,441223,8586,185,150,food&cooking
106,X3ekY_cwVB4,#وجبات_15_ثانية | صينية التوست بالدجاج  15smeals| Chicken Toast Casserole#,6/18/2017,15 ثانية,902001,15809,438,254,food&cooking
107,sjzfJ08b_w4,15#_ثانية | أفخم وصفة ورق عنب حتشوفوها 15s | Stuffed Grape Leaves with Pomegranate Syrup#,7/11/2018,15 ثانية,1130041,18741,426,587,food&cooking
108,T0sKAeyLOGc,#وجبات_15_ثانية | شاورما مدخنة 15s |  Smoked shawarma#,11/6/2016,15 ثانية,378321,8245,179,185,food&cooking
109,P0hY8OWbBiE,#وجبات_15_ثانية | لفائف الباذنجان بالدجاج والجبن 15s | Eggplant rolls with cheese and chicken#,9/24/2016,15 ثانية,223454,5935,84,94,food&cooking
110,A7u_gbpeZ80,15#_ثانية | اصغر ورق عنب ممكن تتخيله !,2/3/2019,15 ثانية,1091814,23341,919,1756,food&cooking
111,ottIEx2waRI,#وجبات_15_ثانية | ام علي بالقشطة الطازجة,6/21/2016,15 ثانية,565074,9392,266,208,food&cooking
112,DXZXFQuitAs,#وجبات_15_ثانية | السليق باللبن 15s | Saliq with ayran milk#,7/20/2016,15 ثانية,379114,5827,183,272,food&cooking
113,OutseUziBeg,#وجبات_15_ثانية | البسبوسه بالحليب المحمص,11/7/2016,15 ثانية,540977,9457,280,479,food&cooking
114,MqFdT-DPXOc,#وجبات_15_ثانية | المرقوق 15s | Al-Margoog #,9/10/2015,15 ثانية,749104,8936,363,465,food&cooking
115,p2v73g7dg88,#وجبات_15_ثانية  |  صينية الارز الكابلي 15s | Afghani Rice in a pan#,8/18/2016,15 ثانية,333407,8201,155,223,food&cooking
116,TH7sWn6IsC0,#وجبات_15_ثانية | كيكة الزبادي بصوص النسكافيه,9/1/2016,15 ثانية,215116,5294,101,136,food&cooking
117,N7yN3rLRCI0,#وجبات_15_ثانية | دجاج التندوري مع بطاطس الودجز   15s | Chicken Tandoori #,1/23/2017,15 ثانية,182840,4584,68,108,food&cooking
118,Atlp_F9ZtDE,#وجبات_15_ثانية | معمول السميد بالتمر والزبدة,9/19/2016,15 ثانية,220156,5832,97,201,food&cooking
119,Xi2eO6-Cd20,#وجبات_15_ثانية | المموش الكويتي  بالروبيان 15s | Kuwaiti Momuash with shrimps#,1/4/2017,15 ثانية,120526,2773,62,111,food&cooking
120,xPXoscOkr4o,#وجبات_15_ثانية | شيش برك 15s | Shish Barak #,8/10/2015,15 ثانية,260500,5229,123,198,food&cooking
121,R-vHbI8lf3g,#وجبات_15_ثانية | طاجن الدجاج والبطاطس 15s | Chicken and Potatoes Tagine#,10/22/2015,15 ثانية,77216,1447,20,39,food&cooking
122,r_MT4beF5gw,#وجبات_15_ثانية | فخذ خروف مشوي 15s | Barbecued lamb leg#,8/29/2016,15 ثانية,204857,5352,118,122,food&cooking
123,aDR_RFlQd-c,سامر المصري المخرج قتل شخصيه أبوشهاب وجعله خائن لذلك تركت باب الحارة,7/12/2015,برنامج ياهلا,16676851,236417,9620,12052,talkshow
124,GmY2emyTvOs,"استمع إلى قصيدة ""يا طير"" للشاعر مساعد الرشيدي من برنامج ياهلا رمضان",6/18/2016,برنامج ياهلا,719754,6128,167,454,talkshow
125,2_z5nwWVrRU,مكالمة مؤثرة بين خالد الدوسري وأمه لأول مرة منذ 9 سنوات,6/14/2020,برنامج ياهلا,707366,11656,277,3931,talkshow
126,drPtSaMgmoQ,فارس عوض محمد نور أقوى كاريزما للاعب عربي,7/16/2015,برنامج ياهلا,429862,5949,123,172,talkshow
127,iKJkkOJTvgU,"الشجاعة جنى: لا أحاول أمد يدي لأحد حتى لا أنحرج، وبعض الناس أول ما يروني يقولون ""بسم الله"" كأني جني!",12/26/2017,برنامج ياهلا,1413318,13292,454,3232,talkshow
128,p6PRiQRpoKg,مساعد الرشيدي:  أنا صاحب بصمة في الشعر ولا أحد يستطيع يقلدني,6/18/2016,برنامج ياهلا,354299,3348,145,283,talkshow
129,InECdbTBPoU,"العمري: لدينا 3 تريليون ريال احتياطي، لا تلعبوا علينا!",9/30/2012,برنامج ياهلا,1534667,11426,492,1849,talkshow
130,BmQZIo5eU_M,غرامة مالية تفاجئ أحد بائعي الورد وتتسبب لفي إغلاق محله!,3/14/2021,برنامج ياهلا,218648,4193,116,2145,talkshow
131,AExGBJ1NLho,تناديك ... ياسر التويجري. |. Tenadeek Yasser Al Twaijiry,5/1/2016,برنامج ياهلا,1057015,5920,301,689,talkshow
132,N2J4HYzOyyc,المعتقل خالد الدوسري في تصريح جديد وخاص لبرنامج ياهلا : منتظر أرحل للسعودية!,6/29/2020,برنامج ياهلا,1075810,22905,749,4335,talkshow
133,HJF5OLilgJU,خالد عبدالرحمن لهذا السبب رفضت أن تغني أحلام أغنية  لاتفسر,6/7/2016,برنامج ياهلا,1507801,8582,711,1190,talkshow
134,MNJ_fIsuiPo,السومة يتكلم عن العروض الأوربية وعن أفضل الاعبين السعوديين والأجانب,6/25/2016,برنامج ياهلا,223549,2065,74,94,talkshow
135,fymC5XrtN-M,الأمير بدر بن عبدالمحسن: يتحدث عن إعجابه بشعر الراحل مساعد الرشيدي,2/16/2017,برنامج ياهلا,248111,2494,75,174,talkshow
136,Uqd1kdBgv28,الأمير بدر بن عبدالمحسن: يتحدث عن طيبة طلال مداح ويقول هو اللي قدمني للناس كشاعر,2/16/2017,برنامج ياهلا,201635,1616,71,189,talkshow
137,JgTmr2xkpu8,"محمد نور: أنا ولد حارة، ولازلت في الحارة، وأحس بالسعادة عندما أساعد أهلي وربعي",6/26/2016,برنامج ياهلا,220960,2416,67,185,talkshow
138,4SRB3UjV01w,عمر السومة يتكلم عن مشكلة المطار ويعتذر لنادى الاتفاق,6/25/2016,برنامج ياهلا,1116092,15328,955,983,talkshow
139,zgooFB3HBzM,عم السجين خالد الدوسري يبكي متأثراً بظلمه ويقول إن شاء الله الحكومة ما تخلي ولدنا,10/16/2015,برنامج ياهلا,959219,9922,318,1367,talkshow
140,Tp35WCUfRIY,خالد عبدالرحمن : بعت سيارتي بـ 11 ألف ريال علشان أول عمل لي .. وإنطلاقتي كانت من ألبوم صارحيني,6/7/2016,برنامج ياهلا,169006,1250,66,96,talkshow
141,kHMNQYhu1K8,أسعف زوجته بسيارة الشركة ففصلوه.. مواطن يشتكي من الفصل التعسفي ويروي الحكاية في ياهلا,10/27/2019,برنامج ياهلا,597361,10230,424,2586,talkshow
